{
  "$schema": "https://json-schema.org/draft/2020-12/schema",
  "$id": "https://github.com/MetaInFLow/EvoZeus-CoEvolve/contracts/v1/migrations/schemas/official-upgrade-profile-v1.schema.json",
  "title": "EvoZeus official upgrade profile v1",
  "type": "object",
  "additionalProperties": false,
  "required": [
    "schema_version",
    "profile_id",
    "profile_version",
    "protocol",
    "from_closure",
    "to_closure",
    "release_axis",
    "automatic",
    "operations",
    "deferred_rendered_surfaces",
    "protected_business_surfaces",
    "fallback"
  ],
  "properties": {
    "schema_version": {
      "const": "evozeus.coevolve.official-upgrade-profile.v1"
    },
    "profile_id": { "type": "string", "minLength": 1 },
    "profile_version": { "pattern": "^v[0-9]+\\.[0-9]+\\.[0-9]+$" },
    "protocol": { "$ref": "#/$defs/binding" },
    "from_closure": { "$ref": "#/$defs/binding" },
    "to_closure": { "$ref": "#/$defs/binding" },
    "release_axis": {
      "type": "object",
      "additionalProperties": false,
      "required": [
        "target_wrapper_from",
        "target_wrapper_to",
        "artifact_source_from",
        "artifact_source_to"
      ],
      "properties": {
        "target_wrapper_from": { "pattern": "^v[0-9]+\\.[0-9]+\\.[0-9]+$" },
        "target_wrapper_to": { "pattern": "^v[0-9]+\\.[0-9]+\\.[0-9]+$" },
        "artifact_source_from": {
          "type": "object",
          "additionalProperties": false,
          "required": ["kind", "revision", "release"],
          "properties": {
            "kind": { "const": "construction_revision" },
            "revision": { "pattern": "^[0-9a-f]{40}$" },
            "release": {
              "anyOf": [
                { "type": "null" },
                { "type": "string", "pattern": "^v[0-9]+\\.[0-9]+\\.[0-9]+$" }
              ]
            }
          }
        },
        "artifact_source_to": {
          "type": "object",
          "additionalProperties": false,
          "required": ["kind", "release", "binding"],
          "properties": {
            "kind": { "const": "required_release" },
            "release": { "pattern": "^v[0-9]+\\.[0-9]+\\.[0-9]+$" },
            "binding": { "const": "contract_bundle.source_revision" }
          }
        }
      }
    },
    "automatic": { "type": "boolean" },
    "operations": {
      "type": "array",
      "items": {
        "type": "object",
        "additionalProperties": true,
        "required": ["change_id", "type", "target_path"],
        "properties": {
          "change_id": { "type": "string", "minLength": 1 },
          "type": {
            "enum": [
              "create_exact",
              "replace_exact",
              "manifest_patch"
            ]
          },
          "target_path": { "$ref": "#/$defs/relativePath" }
        }
      }
    },
    "deferred_rendered_surfaces": {
      "type": "array",
      "items": {
        "type": "object",
        "additionalProperties": false,
        "required": ["target_path", "policy", "version_fact_source"],
        "properties": {
          "target_path": { "$ref": "#/$defs/relativePath" },
          "policy": { "const": "preserve_byte_exact_no_auto_upgrade" },
          "version_fact_source": { "const": ".evozeus-wrapper/wrapper.json" }
        }
      }
    },
    "protected_business_surfaces": {
      "type": "array",
      "items": {
        "type": "object",
        "additionalProperties": false,
        "required": ["selector", "rule"],
        "properties": {
          "selector": { "const": "manifest.instruction_surface" },
          "rule": { "const": "byte_exact" }
        }
      }
    },
    "fallback": {
      "type": "object",
      "additionalProperties": false,
      "required": ["unknown_layout", "scattered_layout", "missing_evidence"],
      "properties": {
        "unknown_layout": { "const": "manual_migration_required_zero_write" },
        "scattered_layout": { "const": "manual_migration_required_zero_write" },
        "missing_evidence": { "const": "manual_migration_required_zero_write" }
      }
    }
  },
  "$defs": {
    "relativePath": {
      "type": "string",
      "minLength": 1,
      "pattern": "^(?!/)(?!.*(?:^|/)\\.\\.(?:/|$))(?!.*\\\\).+$"
    },
    "sha256": {
      "type": "string",
      "pattern": "^[0-9a-f]{64}$"
    },
    "binding": {
      "type": "object",
      "additionalProperties": false,
      "required": ["path", "sha256"],
      "properties": {
        "path": { "$ref": "#/$defs/relativePath" },
        "sha256": { "$ref": "#/$defs/sha256" }
      }
    }
  }
}
